Cargo,Local,Empresa,Descricao,Link
Analista de Arquitetura de Soluções e Engenharia de Dados,Brasil,Accenture,Modelagem e implementação de banco de dados informacionais;Capacidade analítica e crítica de dados;Experiência com modelagem e implementação do banco de dados…,https://tinyurl.com/y2osh8lx
Engenheiro(a) de Dados | Big Data & AI,"Poá, SP",Globo,Domínio das boas práticas de engenharia de software.Conhecimento de banco de dados (SQL ou NoSQL);Conhecimento de stream de dados usando Spark Streaming ou…,https://tinyurl.com/yxnyc66k
Pessoa Engenheira de Dados,"Rio de Janeiro, RJ",Passei Direto,"Arquitetar e construir estruturas para BI, análise e ciência de dados, integrando dados de nossas várias fontes de dados;",https://tinyurl.com/y4r7zne7
Especialista em Engenharia de Dados,"Curitiba, PR",MadeiraMadeira,"Experiência com ferramentas de streaming de dados.Este profissional será responsável pelas decisões técnicas do time de Engenharia de Dados, por isso buscamos…",https://tinyurl.com/y5q2wmnm
Consultor(a) de Engenharia de Dados (SP),"São Paulo, SP",Avanade,Com a manipulação de dados e criação de processos de ETL.Domínio de técnicas de processos de ETL/Modelagem dimensional;Trabalhe com a sua paixão!,https://tinyurl.com/yxhtjw9q
Desenvolvedor(a) Engenharia de Dados Pleno (PE),"Recife, PE",Avanade,Com a manipulação de dados e criação de processos de ETL.Modelar os dados em um ambiente de BigData / DataWareHouse.Amar a área de tecnologia.,https://tinyurl.com/y2nu9tv8
Pessoa Engenheira de Dados | PL,"São Paulo, SP",ClickBus,"Como Engenheiro de Dados do time de Data & Insights, você terá um papel crucial na estruturação de nossa estratégia de gerenciamento de dados na ClickBus,…",https://tinyurl.com/yxtfzvat
Engenheiro(a) de Dados Sênior,Santa Catarina,Magrathea,Elaboração de propostas de desenho de solução para processamento de grande volume de dados.Modelagem de dados para Data Warehouse.O que você fez até aqui?,https://tinyurl.com/y3g6w3cs
Analista Sr (Engenharia de Dados),"São Paulo, SP",GPA,Desenvolvimento de integrações de dados no ecossistema Hadoop;Desenvolvimento de DataMarts para as áreas de negócio;App Pão de Açúcar Mais.,https://tinyurl.com/y3sh3x2f
Coordenador(a) de Engenharia de Dados,"São Paulo, SP",Easynvest,Experiência em liderança de Times / Squads / Projetos de engenharia de dados.Conhecimento em governança de dados.Plano de saúde e odontológico.,https://tinyurl.com/y6z5jf4y
Engenheiro de Dados,Remoto,MIND - Multiplan,Mapear e modelar as estruturas de dados dos processos de negócio relevantes da companhia.Escalar e manter a infraestrutura de dados.,https://tinyurl.com/y2wnabg6
Pessoa Engenheira de Dados Sênior,"Porto Alegre, RS",Lojas Renner,Essa pessoa atuará em conjunto com os times de ciência de dados e de machine learning no desenvolvimento e no uso de tecnologia de dados para projetos da…,https://tinyurl.com/y2adm3zw
[CALINA] Estágio em Engenharia de Dados,"São Carlos, SP",Calina Marketing Digital,"A área de BI dentro da Calina está se expandindo e em Engenharia de Dados você trabalhará com banco de dados de uma maneira geral, extração, manipulação,…",https://tinyurl.com/yxz3mdby
Engenheiro(a) de Dados,"São Paulo, SP",tembici.,"Atuar dentro do time de dados, traduzindo as demandas externas em produtos de dados;Experiência com bancos de dados;Experiência com modelagem de dados;",https://tinyurl.com/yykmtxj9
Engenheiro de Dados Junior,"João Pessoa, PB",Indra,"Fluxos de trabalho de ETL;Você atuará no nosso time de feras no segmento de que atende clientes de administração pública, em projetos estratégicos e em um…",https://tinyurl.com/y2hn5zs7
Engenheiro de Dados,"São Paulo, SP",Conquest One,"Trabalhar junto aos arquitetos de dados e analistas de sistemas dentro de uma metodologia ágil, provendo o pipeline para extração, transformação de carga de…",https://tinyurl.com/y3q5tcl4
